{
  "$schema": "https://json-schema.org/draft/2020-12/schema",
  "$id": "https://ai-coding-harness.local/schemas/cross-run-queue-entry.schema.json",
  "type": "object",
  "additionalProperties": false,
  "required": [
    "schema_version",
    "queue_id",
    "entry_id",
    "run_id",
    "run_dir",
    "job_id",
    "agent",
    "adapter",
    "creator",
    "allowed_worker_id",
    "allowed_worker_groups",
    "status",
    "created_at",
    "updated_at",
    "claim_owner",
    "claim_token",
    "claim_started_at",
    "claim_updated_at",
    "lease_expires_at",
    "terminal_job_status",
    "recovery",
    "cleanup"
  ],
  "properties": {
    "schema_version": { "type": "string", "const": "0.1.0" },
    "queue_id": { "type": "string", "pattern": "^[A-Za-z0-9_.-]+$" },
    "entry_id": { "type": "string", "pattern": "^[A-Za-z0-9_.-]+$" },
    "run_id": { "type": "string", "minLength": 1 },
    "run_dir": {
      "type": "string",
      "minLength": 1,
      "not": { "pattern": "(^/|^[A-Za-z]:|(^|/)\\.\\.(/|$)|\\\\)" }
    },
    "job_id": { "type": "string", "pattern": "^[A-Za-z0-9_.-]+$" },
    "agent": { "type": "string", "minLength": 1 },
    "adapter": { "type": "string", "minLength": 1 },
    "creator": { "type": "string", "minLength": 1 },
    "allowed_worker_id": { "type": ["string", "null"], "minLength": 1 },
    "allowed_worker_groups": {
      "type": "array",
      "items": { "type": "string", "minLength": 1 },
      "uniqueItems": true
    },
    "status": {
      "type": "string",
      "enum": ["queued", "claimed", "running", "succeeded", "failed", "timeout", "cancelled", "abandoned"]
    },
    "created_at": { "type": "string", "pattern": "Z$" },
    "updated_at": { "type": "string", "pattern": "Z$" },
    "claim_owner": { "type": ["string", "null"], "minLength": 1 },
    "claim_token": { "type": ["string", "null"], "pattern": "^[0-9a-f]{32}$" },
    "claim_started_at": { "type": ["string", "null"], "pattern": "Z$" },
    "claim_updated_at": { "type": ["string", "null"], "pattern": "Z$" },
    "lease_expires_at": { "type": ["string", "null"], "pattern": "Z$" },
    "terminal_job_status": {
      "type": ["string", "null"],
      "enum": ["succeeded", "failed", "timeout", "cancelled", null]
    },
    "recovery": { "type": "array", "items": { "type": "string", "minLength": 1 } },
    "cleanup": { "type": "array", "items": { "type": "string", "minLength": 1 } }
  }
}
